{
  "status": "proposal",
  "verification": "text_only",
  "bpm": 88,
  "meter": "4/4",
  "bars": [
    {
      "index": 1,
      "subdivision": "eighth",
      "mora_count": 18,
      "density": "medium",
      "rests": [],
      "accents": [
        "beat_4裏: ゼロコンマ前の一瞬"
      ],
      "held_vowels": [
        "ゼロコンマ=敗因の単位"
      ],
      "breath": "none",
      "voice": "冷静な語り出し",
      "function": "場面提示",
      "entry": "downbeat",
      "fast_zone": null,
      "repeat_count": 0,
      "character_voice": "narrator",
      "narrative_reason": "事故の瞬間を1小節で確定させる",
      "repeat_pattern": null,
      "switch": null,
      "pre_punch_silence": null,
      "confidence": 0.5
    },
    {
      "index": 2,
      "subdivision": "eighth",
      "mora_count": 17,
      "density": "medium",
      "rests": [],
      "accents": [
        "beat_3裏: 顔 の後"
      ],
      "held_vowels": [
        "へこんだ=ガラスの凹みと落胆の二重"
      ],
      "breath": "light_after",
      "voice": "半笑いの独白",
      "function": "自己観察と軽い笑い",
      "entry": "pickup_and_of_4",
      "fast_zone": null,
      "repeat_count": 0,
      "character_voice": "narrator",
      "narrative_reason": "顔の反射で敗北を見せ、深刻さを一段下げる",
      "repeat_pattern": "H1と同型セル",
      "switch": null,
      "pre_punch_silence": null,
      "confidence": 0.5
    },
    {
      "index": 3,
      "subdivision": "eighth",
      "mora_count": 15,
      "density": "medium",
      "rests": [],
      "accents": [
        "beat_4: 買うか の前"
      ],
      "held_vowels": [
        "買うか=語尾上げ"
      ],
      "breath": "none",
      "voice": "問いかけ",
      "function": "選択肢A提示",
      "entry": "downbeat",
      "fast_zone": null,
      "repeat_count": 1,
      "character_voice": "narrator",
      "narrative_reason": "選択肢を対句で並べる",
      "repeat_pattern": "2小節対句セル開始",
      "switch": null,
      "pre_punch_silence": null,
      "confidence": 0.5
    },
    {
      "index": 4,
      "subdivision": "eighth",
      "mora_count": 16,
      "density": "medium",
      "rests": [],
      "accents": [
        "beat_4: 回すか の前"
      ],
      "held_vowels": [
        "回すか=語尾上げ"
      ],
      "breath": "full_after",
      "voice": "問いかけ",
      "function": "選択肢B提示",
      "entry": "downbeat",
      "fast_zone": null,
      "repeat_count": 2,
      "character_voice": "narrator",
      "narrative_reason": "対句の反復で予測を作る",
      "repeat_pattern": "2小節対句セル反復",
      "switch": "なし",
      "pre_punch_silence": null,
      "confidence": 0.5
    },
    {
      "index": 5,
      "subdivision": "sixteenth",
      "mora_count": 17,
      "density": "medium",
      "rests": [],
      "accents": [
        "beat_2: 機械が"
      ],
      "held_vowels": [
        "精算=機械側"
      ],
      "breath": "none",
      "voice": "説明調・低め",
      "function": "主張の前半",
      "entry": "pickup_of_4",
      "fast_zone": "beat_1-2に9モーラ",
      "repeat_count": 1,
      "character_voice": "narrator",
      "narrative_reason": "制度が処理できる領域を先に置く",
      "repeat_pattern": "前置き長→着地短",
      "switch": null,
      "pre_punch_silence": null,
      "confidence": 0.5
    },
    {
      "index": 6,
      "subdivision": "sixteenth",
      "mora_count": 18,
      "density": "medium",
      "rests": [],
      "accents": [
        "beat_2裏: 誰が"
      ],
      "held_vowels": [
        "精算=不在の主語"
      ],
      "breath": "full_after",
      "voice": "詰め寄る",
      "function": "主張の反転",
      "entry": "pickup_of_4",
      "fast_zone": "beat_1-2に11モーラ",
      "repeat_count": 2,
      "character_voice": "narrator",
      "narrative_reason": "同型を延ばして焦らし、主語不在を突く",
      "repeat_pattern": "前置き長→着地短",
      "switch": "subdivisionを16分へ、密度を上げてから空ける",
      "pre_punch_silence": null,
      "confidence": 0.5
    },
    {
      "index": 7,
      "subdivision": "eighth",
      "mora_count": 13,
      "density": "sparse",
      "rests": [
        "beat_1をまるごと空ける"
      ],
      "accents": [
        "beat_4: 出た"
      ],
      "held_vowels": [
        "出た=短く切る"
      ],
      "breath": "before",
      "voice": "ぶっきらぼう・小声",
      "function": "パンチライン",
      "entry": "beat_2から",
      "fast_zone": null,
      "repeat_count": 0,
      "character_voice": "narrator",
      "narrative_reason": "慣用句を字義化する落とし所",
      "repeat_pattern": "セル破棄",
      "switch": "1小節丸ごと密度を落とす（13モーラ）",
      "pre_punch_silence": "beat_1をまるごと空ける",
      "confidence": 0.5
    },
    {
      "index": 8,
      "subdivision": "eighth",
      "mora_count": 18,
      "density": "medium",
      "rests": [
        "領収書の直前に8分休符"
      ],
      "accents": [
        "beat_4: 領収書"
      ],
      "held_vowels": [
        "リョーシューショ=最後を伸ばさず置く"
      ],
      "breath": "full_after",
      "voice": "静かに置く",
      "function": "タイトル着地",
      "entry": "downbeat",
      "fast_zone": null,
      "repeat_count": 0,
      "character_voice": "narrator",
      "narrative_reason": "フックの主題語を無韻で置き、記憶点を作る",
      "repeat_pattern": null,
      "switch": null,
      "pre_punch_silence": "領収書の直前に8分休符",
      "confidence": 0.5
    },
    {
      "index": 9,
      "subdivision": "sixteenth",
      "mora_count": 19,
      "density": "dense",
      "rests": [],
      "accents": [
        "beat_1: 二次会",
        "beat_2: 三次会"
      ],
      "held_vowels": [],
      "breath": "none",
      "voice": "早口・愚痴",
      "function": "原因説明の開始",
      "entry": "pickup_of_4",
      "fast_zone": "beat_1-3",
      "repeat_count": 0,
      "character_voice": "narrator",
      "narrative_reason": "二次会→三次会の増殖で時間の浪費を見せる",
      "repeat_pattern": "二次会/三次会の反復セル",
      "switch": null,
      "pre_punch_silence": null,
      "confidence": 0.5
    },
    {
      "index": 10,
      "subdivision": "sixteenth",
      "mora_count": 17,
      "density": "medium",
      "rests": [],
      "accents": [
        "beat_2裏: 断れないのが"
      ],
      "held_vowels": [
        "限界=言い切る"
      ],
      "breath": "light_after",
      "voice": "引用→地の声",
      "function": "自己分析",
      "entry": "downbeat",
      "fast_zone": null,
      "repeat_count": 1,
      "character_voice": "quoted_then_narrator",
      "narrative_reason": "他人の声を1拍だけ挟み、断れなさを露呈させる",
      "repeat_pattern": null,
      "switch": "1拍だけ引用の声色に切り替える",
      "pre_punch_silence": null,
      "confidence": 0.5
    },
    {
      "index": 11,
      "subdivision": "eighth",
      "mora_count": 17,
      "density": "medium",
      "rests": [],
      "accents": [
        "beat_3: 一円単位"
      ],
      "held_vowels": [],
      "breath": "none",
      "voice": "几帳面な語り",
      "function": "対比の前半",
      "entry": "downbeat",
      "fast_zone": null,
      "repeat_count": 0,
      "character_voice": "narrator",
      "narrative_reason": "金銭の精度を提示する",
      "repeat_pattern": "一円セル",
      "switch": null,
      "pre_punch_silence": null,
      "confidence": 0.5
    },
    {
      "index": 12,
      "subdivision": "sixteenth",
      "mora_count": 19,
      "density": "dense",
      "rests": [],
      "accents": [
        "beat_1: 一円は",
        "beat_3: 一秒は"
      ],
      "held_vowels": [
        "間に合わん=投げる"
      ],
      "breath": "full_after",
      "voice": "苦笑",
      "function": "対比の反転",
      "entry": "downbeat",
      "fast_zone": null,
      "repeat_count": 1,
      "character_voice": "narrator",
      "narrative_reason": "同じ「一」で金と時間を並べ、精度の無力を出す",
      "repeat_pattern": "一円/一秒の対句",
      "switch": "話題を金から時間へ移す",
      "pre_punch_silence": null,
      "confidence": 0.5
    },
    {
      "index": 13,
      "subdivision": "sixteenth",
      "mora_count": 18,
      "density": "medium",
      "rests": [],
      "accents": [
        "beat_3裏: 六台"
      ],
      "held_vowels": [],
      "breath": "none",
      "voice": "観察",
      "function": "場面転換",
      "entry": "pickup_of_4",
      "fast_zone": null,
      "repeat_count": 0,
      "character_voice": "narrator",
      "narrative_reason": "タクシーが実在する＝選択肢が現実であることを示す",
      "repeat_pattern": null,
      "switch": "視線を車道へ移す",
      "pre_punch_silence": null,
      "confidence": 0.5
    },
    {
      "index": 14,
      "subdivision": "sixteenth",
      "mora_count": 21,
      "density": "burst",
      "rests": [],
      "accents": [
        "beat_3: メーターと",
        "beat_4: 後悔"
      ],
      "held_vowels": [],
      "breath": "full_after",
      "voice": "早口",
      "function": "損得のシミュレーション",
      "entry": "downbeat",
      "fast_zone": "小節全域（21モーラ）",
      "repeat_count": 0,
      "character_voice": "narrator",
      "narrative_reason": "最密小節でメーターの回転感を身体化する",
      "repeat_pattern": null,
      "switch": "ヴァースの密度ピーク",
      "pre_punch_silence": null,
      "confidence": 0.5
    },
    {
      "index": 15,
      "subdivision": "sixteenth",
      "mora_count": 19,
      "density": "dense",
      "rests": [],
      "accents": [
        "beat_2裏: なんだかんだで",
        "beat_4: 四桁"
      ],
      "held_vowels": [],
      "breath": "none",
      "voice": "独白",
      "function": "金額の現実",
      "entry": "downbeat",
      "fast_zone": "beat_1-3",
      "repeat_count": 0,
      "character_voice": "narrator",
      "narrative_reason": "残高を数字で開示する",
      "repeat_pattern": "ザンダカ/ナンダカンダの内的反復",
      "switch": null,
      "pre_punch_silence": null,
      "confidence": 0.5
    },
    {
      "index": 16,
      "subdivision": "eighth",
      "mora_count": 17,
      "density": "medium",
      "rests": [],
      "accents": [
        "beat_4: 三桁"
      ],
      "held_vowels": [
        "三桁=短く落とす"
      ],
      "breath": "full_after",
      "voice": "乾いた笑い",
      "function": "bathos着地",
      "entry": "downbeat",
      "fast_zone": null,
      "repeat_count": 1,
      "character_voice": "narrator",
      "narrative_reason": "桁が一つ落ちる笑いで、支払わない理由を確定させる",
      "repeat_pattern": "四桁→三桁の対句",
      "switch": null,
      "pre_punch_silence": null,
      "confidence": 0.5
    },
    {
      "index": 17,
      "subdivision": "sixteenth",
      "mora_count": 18,
      "density": "medium",
      "rests": [],
      "accents": [
        "beat_4: 湯たんぽ"
      ],
      "held_vowels": [],
      "breath": "none",